[
  {
    "id": "hosp-manipal-old-airport",
    "facility_id": "FAC-BLR-001",
    "name": "Manipal Hospital, Old Airport Road",
    "hospital_type": "MULTISPECIALTY",
    "ownership_type": "CORPORATE",
    "address": "98, HAL Old Airport Rd, Kodihalli",
    "city": "Bengaluru",
    "district": "Bengaluru Urban",
    "state": "Karnataka",
    "pincode": "560017",
    "latitude": 12.9592,
    "longitude": 77.6496,
    "beds": 650,
    "icu_beds": 120,
    "emergency_available": true,
    "ambulance_available": true,
    "open_24x7": true,
    "website": "https://www.manipalhospitals.com",
    "data_status": "PUBLIC_REFERENCE",
    "verification_status": "VERIFIED",
    "confidence": "HIGH"
  },
  {
    "id": "hosp-apollo-bannerghatta",
    "facility_id": "FAC-BLR-002",
    "name": "Apollo Hospitals, Bannerghatta Road",
    "hospital_type": "MULTISPECIALTY",
    "ownership_type": "CORPORATE",
    "address": "154/11, Opp. IIMB, Bannerghatta Road",
    "city": "Bengaluru",
    "district": "Bengaluru Urban",
    "state": "Karnataka",
    "pincode": "560076",
    "latitude": 12.8943,
    "longitude": 77.5991,
    "beds": 250,
    "icu_beds": 50,
    "emergency_available": true,
    "ambulance_available": true,
    "open_24x7": true,
    "website": "https://www.apollohospitals.com",
    "data_status": "PUBLIC_REFERENCE",
    "verification_status": "VERIFIED",
    "confidence": "HIGH"
  },
  {
    "id": "hosp-fortis-cunningham",
    "facility_id": "FAC-BLR-003",
    "name": "Fortis Hospital, Cunningham Road",
    "hospital_type": "MULTISPECIALTY",
    "ownership_type": "CORPORATE",
    "address": "14, Cunningham Rd, Vasanth Nagar",
    "city": "Bengaluru",
    "district": "Bengaluru Urban",
    "state": "Karnataka",
    "pincode": "560052",
    "latitude": 12.9876,
    "longitude": 77.5982,
    "beds": 150,
    "icu_beds": 35,
    "emergency_available": true,
    "ambulance_available": true,
    "open_24x7": true,
    "website": "https://www.fortishealthcare.com",
    "data_status": "PUBLIC_REFERENCE",
    "verification_status": "VERIFIED",
    "confidence": "HIGH"
  },
  {
    "id": "hosp-narayana-health-city",
    "facility_id": "FAC-BLR-004",
    "name": "Narayana Health City, Bommasandra",
    "hospital_type": "MULTISPECIALTY",
    "ownership_type": "CORPORATE",
    "address": "258/A, Bommasandra Industrial Area, Anekal Taluk",
    "city": "Bengaluru",
    "district": "Bengaluru Urban",
    "state": "Karnataka",
    "pincode": "560099",
    "latitude": 12.8123,
    "longitude": 77.6921,
    "beds": 1000,
    "icu_beds": 200,
    "emergency_available": true,
    "ambulance_available": true,
    "open_24x7": true,
    "website": "https://www.narayanahealth.org",
    "data_status": "PUBLIC_REFERENCE",
    "verification_status": "VERIFIED",
    "confidence": "HIGH"
  },
  {
    "id": "hosp-victoria-government",
    "facility_id": "FAC-BLR-005",
    "name": "Victoria Hospital (BMCRI)",
    "hospital_type": "TEACHING",
    "ownership_type": "PUBLIC",
    "address": "Fort Rd, near City Market, Kalasipalya",
    "city": "Bengaluru",
    "district": "Bengaluru Urban",
    "state": "Karnataka",
    "pincode": "560002",
    "latitude": 12.9634,
    "longitude": 77.5756,
    "beds": 1200,
    "icu_beds": 150,
    "emergency_available": true,
    "ambulance_available": true,
    "open_24x7": true,
    "website": "https://bmcri.edu.in",
    "data_status": "PUBLIC_REFERENCE",
    "verification_status": "VERIFIED",
    "confidence": "HIGH"
  },
  {
    "id": "hosp-aster-cmi",
    "facility_id": "FAC-BLR-006",
    "name": "Aster CMI Hospital, Hebbal",
    "hospital_type": "MULTISPECIALTY",
    "ownership_type": "CORPORATE",
    "address": "No. 43/2, New Airport Road, NH 44, Sahakar Nagar",
    "city": "Bengaluru",
    "district": "Bengaluru Urban",
    "state": "Karnataka",
    "pincode": "560092",
    "latitude": 13.0567,
    "longitude": 77.5912,
    "beds": 500,
    "icu_beds": 100,
    "emergency_available": true,
    "ambulance_available": true,
    "open_24x7": true,
    "website": "https://www.asterhospitals.in",
    "data_status": "PUBLIC_REFERENCE",
    "verification_status": "VERIFIED",
    "confidence": "HIGH"
  },
  {
    "id": "hosp-sakra-world",
    "facility_id": "FAC-BLR-007",
    "name": "Sakra World Hospital, Bellandur",
    "hospital_type": "MULTISPECIALTY",
    "ownership_type": "CORPORATE",
    "address": "SY NO 52/2 & 52/3, Devarabeesanahalli, Outer Ring Rd, Bellandur",
    "city": "Bengaluru",
    "district": "Bengaluru Urban",
    "state": "Karnataka",
    "pincode": "560103",
    "latitude": 12.9298,
    "longitude": 77.6836,
    "beds": 350,
    "icu_beds": 80,
    "emergency_available": true,
    "ambulance_available": true,
    "open_24x7": true,
    "website": "https://www.sakraworldhospital.com",
    "data_status": "PUBLIC_REFERENCE",
    "verification_status": "VERIFIED",
    "confidence": "HIGH"
  },
  {
    "id": "hosp-st-johns",
    "facility_id": "FAC-BLR-008",
    "name": "St. John's Medical College Hospital, Koramangala",
    "hospital_type": "TEACHING",
    "ownership_type": "TRUST",
    "address": "Sarjapur - Marathahalli Rd, John Nagar, Koramangala",
    "city": "Bengaluru",
    "district": "Bengaluru Urban",
    "state": "Karnataka",
    "pincode": "560034",
    "latitude": 12.9341,
    "longitude": 77.6189,
    "beds": 1350,
    "icu_beds": 180,
    "emergency_available": true,
    "ambulance_available": true,
    "open_24x7": true,
    "website": "https://www.stjohns.in",
    "data_status": "PUBLIC_REFERENCE",
    "verification_status": "VERIFIED",
    "confidence": "HIGH"
  }
]
